title,news_url,source_domain,tweet_num,real,article_content
JUST IN: WaPo Reporter Who Broke News On Judge Roy Moore Story Has A Criminal History Of “Faking” * 100PercentFedUp.com,https://100percentfedup.com/just-wapo-reporter-broke-news-judge-roy-moore-story-criminal-history-faking/,100percentfedup.com,220,0,"Alabama Senate candidate Roy Moore is denying that he romantically pursued teenagers as young as 14 while he was in his 30s after a bombshell report.

The women accusing Moore told the Washington Post that when they were between the ages of 14 and 18, he romantically pursued them.

One woman, Leigh Corfman, told the Post that when she was 14 years old in 1979, a 32-year-old Moore “took off her shirt and pants and removed his clothes.”

Corfman told the Post that Moore “touched her over her bra and underpants, she says, and guided her hand to touch him over his underwear.”

The outspoken social conservative said in a statement the four women quoted by the Washington Post are lying.

“This garbage is the very definition of fake news and intentional defamation,” Moore said.

ADVERTISEMENT

Former White House adviser Stephen Bannon helped Moore trounce establishment favorite Luther Strange in a September Republican primary, over President Trump’s warning that Moore was less electable.

Moore currently is in a close race against Democrat Doug Jones ahead of a Dec. 12 election. – Washington Examiner

Stephanie McCrummen, the reporters who co-wrote the Washington Post hit piece on Judge Roy Moore, apparently has a history of “faking” things like fake checks for instance…

According to the anti-Trump publication, Red State, McCrummen, who works for the Washington Post, (who many consider to be “fake news, after using mulitple “unnamed sources” in an attempt to tie President Trump to the Russians), has a criminal record that involves writing a FAKE check.

Ms. McCrummen has a rather interesting criminal history herself, as public criminal records in multiple states stretching across 4 time zones have shown.

Ms. McCrummen’s criminal history began with North Carolina Case # 1992 CR 00654, a violation of the Article 19 – False Pretenses and Cheats section of the North Carolina Criminal Code. Ms. McCrummen was convicted of a crime punishable by up to six months of imprisonment for writing a hot check that was deemed worthless.

Ms. McCrummen’s other offenses are all traffic related and in 2010, she was tracked down by the courts after she had escaped Arizona’s jurisdiction to D.C., and her case was assigned to the Fines/Fees and Restitution Enforcement (FARE) Program established to collect delinquent court ordered restitution, fines, fees, and surcharges . After the FARE team tracked her down at her Washington D.C. apartment, they finally appeared to get her attention and on October 23, 2010 she paid the defaulted fine to the criminal court, almost two months after her conviction. McCrummen has now found herself a four-time loser in the states’ criminal courts. She currently resides outside of the jurisdiction of the three states where she committed her crimes.

Sean Hannity ripped into the media frenzy over the Judge Moore scandal on his show last night. The left is calling for his head today:

https://twitter.com/MichelleRMed/status/928971595087073280

When a reporter has a criminal history that essentially proves she gave false information to pay a debt or for services, shouldn’t her character come into question when it comes to making a 40 year old sexual allegation against one of the most hated, Steve Bannon backed conservatives running for office in America, that may help to enhance her career?"
Alabama football Crimson Tide disqualified from national championship,http://www.breakingnews365.net/59f509292adf6/alabama-football-crimson-tide-disqualified-from-national-championship.html,www.breakingnews365.net,2,0,"Tirez les cartes du Tarot

Aujourd'hui, la voyance une carte est accessible à tous. Tout le monde peut tirer les cartes, le secret réside dans l'interprétation de leur message. Ici, vous pouvez réaliser un tirage de Tarot gratuitement, pour connaître la tendance de votre journée, obtenir une réponse à une question ou résoudre un dilemme. Le principe est simple, il suffit de cliquer sur le jeu pour tirer une carte, l'interprétation de celle-ci s'affiche à côté.

Connaître la tendance de la journée

Le tarot peut être interrogé autant que nécessaire. Vous pouvez donc tirer une carte chaque jour afin de connaître la tendance de votre journée, comme un horoscope quotidien, avec l'avantage d'être précis et personnalisé.

Offre d'essai pour une consultation avec une voyante professionnelle

Pour un tirage complet, qui vous donnera votre avenir sur plusieurs mois, voire sur plusieurs années, profitez de notre offre d'essai pour une consultation avec une vraie voyante. Nous vous offrons 10 minutes gratuites au téléphone avec une voyante professionnelle. Vous pouvez lui poser toutes vos questions, et lui demander tous les détails sur ce qui vous attend.

Restons en contact

Pour recevoir nos offres, conseils voyance et astuces pour rester maître de votre destin, inscrivez-vous à la newsletter ! Sans fioritures, vous ne recevrez que des mails intéressants pour vous, et qui vous apporteront ce petit plus pour toujours garder une longueur d'avance."
BREAKING: Clinton Foundation Cargo Ship Raided At Port Of Baltimore Reveals Sick Secret,https://web.archive.org/web/20170515100952/http://dailyusaupdate.com:80/breaking-clinton-foundation-cargo-ship-raided-port-baltimore-reveals-sick-secret,web.archive.org,912,0,"A ship owned and operated by the Clinton Foundation was raided as it arrived from Africa this morning at the Port of Baltimore. The ship, which was supposed to be carrying “emergency supplies,” was actually carrying a cargo that had authorities stunned. BPA Harbormaster Jake Cummings explained to CNN:

“We received a tip that the Clinton Foundation flagship, The Chelsea, was carrying illegal contraband into the United States. We honestly didn’t know what to expect, but what we found was simply…surreal. In the middle of the ship’s large manifest of containers, most of which were empty, we found 14 containing…people. Yes, people. They were all Refugees from places like Yemen and Syria and not a single one had any kind of documentation. We interviewed those who spoke English and were told that for $40K, anyone can catch a ride to the United States on a ship nobody would ever suspect.”

Immigration was immediately called and found that of the 460 people on board illegally, not one had been through any kind of vetting process. After running the men through facial recognition, they found more than a dozen suspected terrorists who are on the US no-fly list. Those men were about to be unleashed on the public for $40K each."
"Somali Immigrant Crashes Car Into Ohio Families Home, Killing The Infant At Home",http://dailyheadlines.net/burka-clad-woman-runs-over-baby-gets-away-with-crime-for-1-stunning-reason/,dailyheadlines.net,19,0,"A woman in Columbus, Ohio, was arrested, charged and convicted after she hit and killed a 7-month-old baby with her car.

Muhuba Mohamed was found guilty of aggravated vehicular homicide after she struck a man who was pushing an infant in a stroller along the side of the road. Mohamed then crashed into a house.

The man pushing the stroller was identified as 23-year-old Kenan Ferebee, and the child was his 7-month-old son, Micah.

The baby was pronounced dead at an area hospital. The child’s father was taken to a different hospital in critical condition, WBNS reported.

A witness said Mohamed had a phone in her hand at the time of the crash, but there was no evidence of any texts or calls being received at the time. Four days earlier, the woman was in an accident in which she crashed into a median, The Columbus Dispatch reported. In both cases, she was driving on a temporary permit without an accompanying licensed driver.

“Not one of those single things amounts to recklessness,” Judge Laurel Beatty Blunt said. “But when you look at the totality of the circumstances, the court does rule that it does amount to reckless conduct.”

Mohamed, a native of Somalia, reportedly faced a prison sentence if convicted, but was allowed to remain free until her sentencing.

“If an American did the same thing they would be in jail for a long time,” one Mad World News reader commented on the site’s Facebook page. “She should get the same or more being the 2nd accident in 4 days. Going off the side of the road and running over 2 innocent people killing a helpless baby. Come on people. Give her life in prison. She deserves more than that but I’m sure she won’t get the death penalty. What in the hell kind of Justice system do we have now.”

“Define for me the difference between reckless conduct and recklessness,” another wrote. “Maybe in OHIO they speak different English than I do, after all I am from a rural state and may not understand the high English as interpreted by more citified judges. Where is justice? If a Caucasian teenager did this… You finish the sentence.”"
Clinton Foundation Largest Unprosecuted Charity Fraud in History-Charles Ortel,https://usawatchdog.com/clinton-foundation-largest-unprosecuted-charity-fraud-in-history-charles-ortel/,usawatchdog.com,291,0,"Greg Hunter

Greg is the producer and creator of USAWatchdog.com. The site’s slogan is “analyzing the news to give you a clear picture of what’s really going on.” The site will keep an eye on the government, your financial interests and cut through the media spin. USAWatchdog.com is neither Democrat nor Republican, Liberal or Conservative. Before creating and producing the site, Greg spent nearly 9 years as a network and investigative correspondent. He worked for ABC News and Good Morning America for nearly 6 years. Most recently, Greg worked for CNN for shows such as Paula Zahn Now, American Morning and various CNN business shows."
BREAKING: Illegal Muslim From Iran Arrested For Starting California Wildfire,http://pegida.trendolizer.com/2017/10/breaking-illegal-muslim-from-iran-arrested-for-starting-california-wildfire.html,pegida.trendolizer.com,456,0,"About Trendolizer™

Trendolizer™ (patent pending) automatically scans the internet for trending content. The website you are looking at has no human editors at all: links to trending stories are automatically posted from a selection of the data Trendolizer™ picked up. If you are interested in using the Trendolizer™ engine, dashboard or API for your own projects, more information is available at get.trendolizer.com . Trendolizer™ is owned by Lead Stories LLC.

Privacy policy

This site uses cookies to track user behaviour on this site, without linking to personally identifiable data. Advertisers may also use cookies, but the scope and nature of this use is beyond our control."
Puerto Rico Mayor Facing Fraud Charges Over $3M In Federal Disaster Relief,https://yournewswire.com/puerto-rico-mayor-fraud-disaster/,yournewswire.com,180,0,"Sports

GET $750 IN BONUS FUNDS ON YOUR FIRST TWO DEPOSITS"
Malia Obama Arrested With A Gang Of Thugs In Chicago,http://breaking13news.com/malia-obama-arrested-gang-thugs-chicago/,breaking13news.com,241,0,"Malia Obama may have done irreparable harm to her career this morning when she decided to join a gang of thugs in Chicago for a day of drinking, drugs and dogfighting at a public park in Chicago. Malia was arrested along with seven others and charged with wanton endangerment of animals, public intoxication and possession of a controlled substance.

She was found in the company of mostly older men when police arrived after being called by a concerned citizen complaining about a loud group of people watching dogs fight in the park. According to a witness:

“They was all just right out there in the open drinkin’ and lettin’ their dogs go at it. I saw some smoking weed. Some were doing other things I don’t know. All those dudes had that baggy pants thing. They weren’t the types of people you’d expect that girl to be with.”

According to the Secret Service, Malia had slipped away late last night after being told open air parties at public parks were too dangerous. She wasn’t seen again until she showed up in the 12th precinct jail. Her parents have not been available for comment.

Public records show she was released on her own recognizance and given a court date of later this month for arraignment."
Tom Price: “It’s Better For Our Budget If Cancer Patients Die More Quickly”,http://www.newslo.com/price-better-budget-cancer-patients-die-quickly/,www.newslo.com,181,0,"Are you prepared for retirement or on pace to be ready when the time comes to call it a career? According to one source, around seven in 10 — 71%…

Share"
Breaking: Mar-A-Lago Destroyed By Irma-Jared Kushner Still Missing,https://web.archive.org/web/20170914182404/http://freedumjunkshun.com:80/mar-a-lago-is-missing-after-kushner-destroyed/,web.archive.org,4,0,"The building Jared Kushner was reportedly in is gone. .

Mar-A-Lago was at the front and center of a rogue wave created by the outer bands of Hurricane Irma. The wave, spanning hundreds of yards across and nearly 20-feet high crashed directly into the Palm Beach estate of President Trump.

Several other properties on either side, including the home of guitar legend Kieth Richards, were also destroyed. The staff at Mar-A-Lago had been sent home except for those who live on the property. They were all in the “safe” building towards the rear of the property when the wave hit.

The building, designed by Eric Trump, was supposed to be able to withstand bunker-busting bombs. He told the National Report that the reason the water was able to penetrate was simple physics:

“I designed the building for an air raid. Who would ever think that the threat would come from the side? Those walls were just normal walls to keep cost down. The roof was what was designed to absorb the impact. Mass equals force times accelarated ions.”

Eric Trump was a decorated mathematician at Oxford and scored well above genius on the Hershman-Rorytar Test. Clearly, the fault for Kushner’s probable fate lies with Kushner himself for not seeking proper shelter."
BREAKING: Trump Removes Muslim Federal Judge For Trying To Implement Sharia Law In America,http://www.trendolizer.com/2017/07/breaking-trump-removes-muslim-federal-judge-for-trying-to-implement-sharia-law-in-america.html,www.trendolizer.com,355,0,"About Trendolizer™

Trendolizer™ (patent pending) automatically scans the internet for trending content. The website you are looking at has no human editors at all: links to trending stories are automatically posted from a selection of the data Trendolizer™ picked up. If you are interested in using the Trendolizer™ engine, dashboard or API for your own projects, more information is available at get.trendolizer.com . Trendolizer™ is owned by Lead Stories LLC.

Privacy policy

This site uses cookies to track user behaviour on this site, without linking to personally identifiable data. Advertisers may also use cookies, but the scope and nature of this use is beyond our control."
"Haiti Official Getting Ready To Testify Against Clinton Foundation Corruption NEXT WEEK, Found DEAD With “Gunshot to the head”",https://web.archive.org/web/20180117041602/http://theuspoliticalnews.com:80/haiti-official-getting-ready-to-testify-against-clinton-foundation-corruption-next-week-found-dead-with-gunshot-to-the-head/,web.archive.org,45,0,"It’s absolutely clear that the Clinton Foundation has faced some honest reports of stealing from impoverished Haitians devastated in the 2008 Hurricane Hanna, and straight through their own foundation. For years the Haitians have been struggling and protesting outside the Clinton Foundation offices over the robbery. The money taken was donated by the individuals and business directly to the Clinton Foundation, thinking they were going to receive aid. However, the opposite it true. The money never even made it to the poorest of the poor. Now we have one man ready to testify against the corrupt Clinton Foundation in the upcoming week. However, the 50 year old man, a former Haitian government official Klaus Eberwein, was found dead in his Miami home with a “gunshot to the head” that’s been ruled a “suicide” by the Miami-Dade’s medical examiner records supervisor.

Klaus Eberwein, a former Haitian government official who was expected to expose the extent of Clinton Foundation corruption and malpractice next week, has been found dead in Miami. He was 50.

Eberwein was due to appear next Tuesday before the Haitian Senate Ethics and Anti-Corruption Commission where he was widely expected to testify that the Clinton Foundation misappropriated Haiti earthquake donations from international donors.

Eberwein, who had acknowledged his life was in danger, was a fierce critic of the Clinton Foundation’s activities in the Caribbean island, where he served as director general of the government’s economic development agency, Fonds d’assistance économique et social, for three years. According to Eberwein, a paltry 0.6% of donations granted by international donors to the Clinton Foundation with the express purpose of directly assisting Haitians actually ended up in the hands of Haitian organizations. A further 9.6% ended up with the Haitian government. The remaining 89.8% – or $5.4 billion – was funneled to non-Haitian organizations.

“The Clinton Foundation, they are criminals, they are thieves, they are liars, they are a disgrace,” Eberwein said at a protest outside the Clinton Foundation headquarters in Manhattan last year.

The former director general of Haiti, who also served as an advisor to Haitian President Michel Martelly, was also a partner in a popular pizza restaurant in Haiti, Muncheez, and even has a pizza — the Klaus Special — named after him.

According to the Haiti Libre newspaper, Eberwein was said to be in “good spirits“, with plans for the future. His close friends and business partners are shocked by the idea he may have committed suicide.

“It’s really shocking,” said Muncheez’s owner Gilbert Bailly. “We grew up together; he was like family.” –Your News Wire

Americans were warned about the crooked dealings of the Clinton Crime family when in September of 2016, former Senate President of Haiti, Bernard Sansaricq, shocked a large crowd at a Trump campaign event in Little Haiti, FL. Sansaricq stood up during the public event and relayed his account of the Clinton’s dirty dealings in Haiti while he was still in office. To his credit, candidate Donald Trump allowed Sansaricq to speak his mind, and to expose the crimes of the Clinton’s, who were attempting to scratch and claw their way back into our White House.

Sansaricq claimed he begged the Clinton Administration not to invade Haiti. His request was followed up with a visit by an anonymous messenger from the White House who encouraged him to “side” with the Clinton Administration and he would “be the richest man in Haiti.”

He also demanded that Hillary Clinton “disclose the audit of all money” related to the Haiti earthquake crisis, as he claimed they scammed the poorest citizens of Haiti out of BILLIONS of dollars through the Clinton Foundation.

“Not even 2% of that money went back to Haiti. So Mr. Trump, we are asking you, begging you, the Haitian community will side with you if one day, you ask Hillary Clinton publicly to disclose the audit of all of the money they have stolen from Haiti in 2010 after the earthquake. Haiti is a very poor country. Haiti needs defenders. You said you would champion our cause. We welcome you sir and we will work with you. Ask Hillary Clinton publicly, during your next debate for an audit of all of the money they have stolen from Haiti.”

Go to the 5 minute mark of the video to see Sansaricq’s comments to candidate Trump:

Like this: Like Loading..."
BREAKING NEWS: Prince William and Harry donates $100 million to Hurricane Harvey Victims,http://disaster.trendolizer.com/2017/08/breaking-news-prince-william-and-harry-donates-100-million-to-hurricane-harvey-victims.html,disaster.trendolizer.com,0,0,"About Trendolizer™

Trendolizer™ (patent pending) automatically scans the internet for trending content. The website you are looking at has no human editors at all: links to trending stories are automatically posted from a selection of the data Trendolizer™ picked up. If you are interested in using the Trendolizer™ engine, dashboard or API for your own projects, more information is available at get.trendolizer.com . Trendolizer™ is owned by Lead Stories LLC.

Privacy policy

This site uses cookies to track user behaviour on this site, without linking to personally identifiable data. Advertisers may also use cookies, but the scope and nature of this use is beyond our control."
