title,news_url,source_domain,tweet_num,real,article_content
Trump to Jimmy Fallon: 'Be a man.' Late-night host answers with donation to help migrants.,https://www.nbcnews.com/politics/donald-trump/trump-tells-jimmy-fallon-be-man-over-hair-tussling-episode-n886221,www.nbcnews.com,20,1,"WASHINGTON — President Donald Trump is telling ""Tonight Show"" host Jimmy Fallon to ""be a man"" and stop ""whimpering"" about the personal anguish he felt over the backlash he received after messing up Trump's hair during a 2016 campaign appearance on the late-night talk show.

Fallon recently told The Hollywood Reporter that he ""made a mistake"" on the Sept. 15, 2016, episode and would do it differently.

During that interview with the presidential candidate, Fallon thanked Trump ""for giving us the material that we are doing"" and said he has been ""amazing to follow"" because ""you say some shocking things that I cannot even believe.""

""But I'm trying not to anyway,"" Trump replied.

Fallon's latest comments, however, didn’t appear to sit well with Trump.

The president tweeted Sunday:

.@jimmyfallon is now whimpering to all that he did the famous “hair show” with me (where he seriously messed up my hair), & that he would have now done it differently because it is said to have “humanized” me-he is taking heat. He called & said “monster ratings.” Be a man Jimmy! — Donald J. Trump (@realDonaldTrump) June 25, 2018

Fallon responded on Twitter with a nod to the plight of young immigrants caught up in administration policies.

""In honor of the President’s tweet I’ll be making a donation to RAICES in his name,"" Fallon said, referring to a nonprofit organization that provides free and low-cost legal services to immigrant children, families and refugees in Texas.

In honor of the President’s tweet I’ll be making a donation to RAICES in his name. — jimmy fallon (@jimmyfallon) June 25, 2018

The Refugee and Immigrant Center for Education and Legal Services, or RAICES, is the largest immigration legal services provider in Texas. The organization is on the front lines of the immigration battle in Texas."
Moana Hits Netflix Today So Let’s Celebrate With This Adorable 4-Year-Old Singing Her Heart Out,https://medium.com/@AndreAguirre25111NTZ/moana-hits-netflix-today-so-lets-celebrate-with-this-adorable-4-year-old-singing-her-heart-out-3248ec1f458e,medium.com,58,1,"Moana Hits Netflix Today, So Let’s Celebrate With This Adorable 4-Year-Old Singing Her Heart Out

Moana is officially available on Netflix today, and there’s no better way to celebrate than by watching a 4-year-old’s gloriously passionate performance of “How Far I’ll…

http://ift.tt/2sNKKMP"
How to get Meghan Markle-worthy lips in 3 easy steps,https://www.redonline.co.uk/beauty/10-best/a23580879/meghan-markle-nude-lipstick-how-to/,www.redonline.co.uk,74,1,"Meghan Markle has inspired many a trend since officially entering the royal family in May. Even before she'd been given her new title of Duchess of Sussex, her polished sense of style was lauded world over and her every move copied and analysed by fashion and beauty experts.

Related Story Why people think Meghan's hair is a pregnancy hint

No more so than her hair, nail colour, love of boat-neck dresses and, most importantly, her lip colour... (seen her in her engagement photo with Prince Harry)

Getty Images

Usually the season where red lipsticks are tentatively worn alongside our winter wardrobes, thanks to 'the Meghan-effect', nude lipsticks are higher than ever on our winter wish-lists, and being favoured over their red predecessor.

What to Read Next

We've hunted down her reported exact lipstick in the hopes of looking a little more regal this Christmas, and provided some basic tips on how to perfect your pout to rival the Duchess:

Charlotte Tilbury Matte Revolution lipstick in Very Victoria, £24

Reported to be Markle's favourite lipstick; we love the dark blush 3D tones, and the fact that the lipstick glides on seamlessly thanks to orchid and lipstick tree extracts, slicks on with a matte finish and never looks dry on the lips thanks to a blend of oils and waxes.



Previously out of stock (unsurprisingly), Charlotte Tilbury have obviously wised up and now seems to be kept in regular stock online.

3 steps to Duchess-worthy lips:



1. Prime

Your lips will never look like Meghan's if you just splash some lipstick onto chapped, winter lips, and slathering them with heavy lip balm first will just cause the colour to wear off immediately (an absolute disaster if you have a day of royal engagements ahead of you, which obviously we do), so priming the blank canvas first is a must, just as we would our skin.

First, exfoliate lips gently with a lip scrub, then apply a deeply moisturising lip mask (leave on for 5 minutes, then wipe away any excess)



2. Apply lipstick

Now that you have the perfect base, apply lip stick with a lip brush (to get into every crevice and limit the risk of it wearing off throughout the day) evenly over the whole lip area and pay close attention to the edges - a true Duchess would never be caught dead with bleeding or smudged lipstick



3. Set

Now that the colour is on perfectly, you want itstay on, all that air-kissing and smiling is bound to take it's toll. Blot lips with a single sheet of tissue paper and gently dust loose powder on top of the sheet. For a more natural, dewy finish - spritz lips with a makeup setting spray, just as you would the rest of your face."
"James Van Der Beek Reveals He's Been Sexually Harassed By 'Older, Powerful Men'",https://www.huffingtonpost.com/entry/james-van-der-beek-sexual-harassment_us_59df1a83e4b0eb18af063d84,www.huffingtonpost.com,74,1,"LOADING ERROR LOADING

The wave of women coming forward accusing Harvey Weinstein of sexual harassment or assault has prompted some men to speak out with their own stories of sexual misconduct in Hollywood.

In a series of tweets, “Dawson’s Creek” star James Van Der Beek said that he “had my ass grabbed by older, powerful men.”

Advertisement

I’ve had my ass grabbed by older, powerful men, I’ve had them corner me in inappropriate sexual conversations when I was much younger... — James Van Der Beek (@vanderjames) October 12, 2017

I understand the unwarranted shame, powerlessness & inability to blow the whistle. There’s a power dynamic that feels impossible to overcome — James Van Der Beek (@vanderjames) October 12, 2017

What Weinstein is being accused of is criminal. What he’s admitted to is unacceptable - in any industry. I applaud everybody speaking out. — James Van Der Beek (@vanderjames) October 12, 2017

Advertisement

“Brooklyn Nine-Nine” star Terry Crews shared a similar story on Tuesday, recounting when a “high level” executive “groped my privates.” He said he didn’t speak out at the time for fear of losing job opportunities.

“240 lbs. Black Man stomps out Hollywood Honcho” would be the headline the next day. (5/cont.) — terrycrews (@terrycrews) October 10, 2017

The actors’ allegations follow damning reports in The New York Times and The New Yorker detailing decades of Weinstein’s alleged misconduct. More than a dozen women have come forward, including three who have accused him of rape. The now-disgraced Hollywood titan has received widespread condemnation, including from former President Barack Obama. On Sunday, Weinstein was fired from his namesake company."
Melrose Place Star Josie Bissett Is Married! See Photos of the Outdoor Ceremony,https://www.brides.com/story/melrose-place-star-josie-bissett-wedding-photos,www.brides.com,31,1,"Kate Hudson Wants to Be ""Engaged Forever"" for the Most Relatable Reason: ""It's Going to Cost So Much Money"""
The 16 Most CLIMACTIC Moments From the New Fifty Shades Freed Trailer,https://www.cosmopolitan.com/entertainment/movies/a13427671/fifty-shades-freed-trailer-moments-climax/,www.cosmopolitan.com,16,1,"Now that you've seen the final Fifty Shades Freed trailer at least eight or nine more times, it's time to slow things down and revisit some of the hotter and exciting moments in the 2-minute spectacle. Since the trailer begs fans to not ""miss the climax,"" let's spend a little more time analyzing every kiss and shirtless frame, along with anything else that might stroke your interest.

1. When Christian touches Ana's morning hair and says “Good morning, wife.” Marriage looks good on Christian, doesn't it?

Universal Pictures

2. When they kiss for the first time in the trailer. It's almost like you're there, so close you can smell their morning breath.



Universal Pictures

3. When he calls her outside her office. Get you a man who likes to match his clothes with his car.

Universal Pictures

4. When he walks out of the ocean shirtless. This one you're familiar with.

Universal Pictures

5. When he licks her leg. I sure hope Ana didn't moisturize just before this lickathon. Unless it's edible lotion or something.

Universal Pictures

6. “Ana Grey’s office.” Have you met SIP's new fiction editor? A job promotion via your new husband is always exciting.

Universal Pictures

7. This look. Who needs a new/old house when you've got a man looking at you like this for the rest of your life?

Universal Pictures

8. No, THIS look. Gia, didn't you hear? Her name is Ana Grey. Stop touching her husband!

Universal Pictures

9. “You may call me Mrs. Grey.” Warned you.

Universal Pictures

10. This wink.

Universal Pictures

11. When Ana tries to lose a follower on the road by auditioning for the next Fast and Furious movie. Don't you just love a good car chase scene? Vin Diesel, are you seeing this?

Universal Pictures

12. When Christian showers. Part one.

Universal Pictures

13. When Christian showers. Part two. And look at Ana's giant rock! Are you sure you don't have to take that off for showers?

Universal Pictures | Getty

14. “So you wanna play?” ""Yes, sir."" Yes! The Red Room is back!

Universal Pictures

15. When Rita Ora shows up. TWICE!

Universal Pictures

Universal Pictures

16. When the most faithful bodyguard in Seattle, Taylor, shows up. Hey Taylor. Your fans have missed you.

Universal Pictures

Fifty Shades Freed opens Feb. 14, 2018.

Follow Peggy on Twitter and Cosmo Celeb on Facebook."
Quavo Reportedly Dumps Karrueche For Stripper Girlfriend: Migos Star Blames Chris Brown For Split?,https://article.wn.com/view/2017/07/10/Quavo_Reportedly_Dumps_Karrueche_For_Stripper_Girlfriend_Mig/,article.wn.com,87,1,"Quavo has reportedly dumped Karrueche Tran following a Snapchat video that seemed to suggest the couple had parted ways from one another. Earlier this week, the Migos star took to his social media handle to write “New B*tch Alert,” insinuating that his relationship with... read full story"
Judge denies Rose McGowan’s motion to dismiss felony cocaine possession charge,https://www.mercurynews.com/2018/03/12/judge-denies-rose-mcgowans-motion-to-dismiss-felony-cocaine-possession-charge/,www.mercurynews.com,31,1,"Rose McGowan’s legal team has argued that Harvey Weinstein was responsible for planting drugs in the actresses’ wallet. A Virginia judge wasn’t convinced it was enough to drop the felony cocaine possession charge against the “Charmed” actress.

Judge Deborah Welsh of Loudoun County General District Court on Monday denied McGowan’s motion to dismiss the case from January 2017, when an airplane cleaning crew found McGowan’s wallet next to the seat she had occupied for a flight to Dulles International Airport. The wallet allegedly contained two bags that tested positive for cocaine.

McGowan’s lawyer filed paperwork in February claiming Weinstein might have set up the actress.

“It is now public knowledge that Weinstein employed underhanded tactics to ‘silence’ his victims,” Jessica Carmichael said in court documents, according to the People. It has been reported that Weinstein hired intelligence agencies to spy on his accusers.

Carmichael also said five hours elapsed from when her client deplaned to the time that her wallet discovered.

“There is simply no point in time at which the evidence places Ms. McGowan and the cocaine together in the same place,” she wrote, according to the Daily News.

Judge Welsh said it would be premature to dismiss charges against McGowan prior to her March 21 preliminary date. Prosecutors have also said they have additional evidence that were not included in the original charges filed against McGowan.

McGowan herself floated the idea that Weinstein was retaliating against her for her naming him as her alleged rapist.

Related Articles Sean ‘Diddy’ Combs trial: Most shocking bombshells from Cassie testimony

Prince Harry’s possible endgame in security row could cost US taxpayers

The man who stabbed author Salman Rushdie on stage has been sentenced to 25 years in prison

Tom Cruise’s strange 20-year journey since his Oprah Winfrey couch jump

Tiffany Trump’s birth announcement seems strangely discreet for a Trump baby She was one of the first of more than 50 women who have accused the former Hollywood mogul of sexual harassment, assault or rape. Gwyneth Paltrow, Ashley Judd and Angelina Jolie are among his other accusers.

Weinstein has denied all allegations against him."
The Crazy-Funny Way Tracee Ellis Ross Puts on Moisturizer,https://gossipbucket.com/e-online/1156358/the-crazy-funny-way-tracee-ellis-ross-puts-on-moisturizer/,gossipbucket.com,45,1,"A big swirling bucket of the latest rumors, celebrity news and Hollywood gossip. The premier celebrity gossip app. The only apps that gives you a comprehensive real time celeb news stream.

Gossip Bucket aggregates and streams the latest gossip news and headlines from the top sources in one place."
Sarah Stage Steps on the Scale 2 Weeks After Giving Birth to Reveal Her Post-Pregnancy Weight,https://people.com/bodies/sarah-stage-shows-off-weight-two-weeks-after-giving-birth/,people.com,56,1,"She became known as the “six-pack mom” for her ability to keep her toned abs during her two pregnancies. And on Thursday, lingerie model Sarah Stage showed off her post-pregnancy weight just two weeks after the birth to her second child.

The 33-year-old social media star stepped on the scale in a photo for her Instagram Story captured by E!, showing that she was down to 124.8 pounds. “Going to keep on sticking to my nutrition guide,” she wrote on the picture.

It was the first time Stage had weighed herself since in the arrival of son Logan Alexander, who was born via c-section on Oct. 16. He weighed-in at 7 lbs. and 2 oz., and was 19 inches long.

While Stage didn’t reveal the final amount of weight she had ultimately gained during her pregnancy, she had previously shared in August (when she was 8 months pregnant) that she had only gained 18 pounds.

Stage said Friday that her followers had been asking her on social media about her post-pregnancy weight loss, E! reported.

The mother of two, who shares Logan Alexander and 2 ½-year-old big brother James Hunter with husband Kris Jason, has faced criticism for her small belly during both pregnancies.

Sarah Stage/Instagram

RELATED: Model Sarah Stage Keeps Up Her Workouts as She Hits Her 9th Month of Pregnancy



“Since I’ve announced my second pregnancy, I’ve had certain ‘Instagram medical experts’ tell me what I should and shouldn’t do,” she wrote in a September post while taking on the critics. “And while I find some of the comments hilarious, I choose to only listen to my OB/GYN and of course I also listen to MY body. If something feels off, I don’t do it! I always do what’s best for my growing baby and put him first!”

“It’s a proven medical fact that continuing exercising while pregnant has many health benefits for you and baby,” she added. “There are also some people who assume that since I am exercising while pregnant, that I’m obsessed with how I ‘look’ but in fact I’m obsessed with maintaining a healthy lifestyle that will give my baby and myself the best possible quality of life.”

As she continues to recover from her c-section, Stage is resting at home with her family.

“Enjoying this newborn phase,” she wrote on Instagram Oct. 30. “It’s true what everyone says that it goes by so fast. It’s been nice resting, healing and cuddling with the babes. Still recovering from c section and continuing to take it easy at home. My goal is to make it all the way through trick or treating tomorrow with the family #csectionrecovery #2weeksold #momlife #2under3Club.”

She stayed true to her promise, dressing up the next day as Star Wars characters for the big day."
Pink announces Beautiful Trauma UK tour 2019: How to get tickets,https://www.independent.co.uk/arts-entertainment/music/news/pink-beautiful-trauma-tour-uk-tickets-london-dublin-cardiff-how-to-get-a8586231.html,www.independent.co.uk,17,1,"Sign up to Roisin O’Connor’s free weekly newsletter Now Hear This for the inside track on all things music Get our Now Hear This email for free Get our Now Hear This email for free Email * SIGN UP I would like to be emailed about offers, events and updates from The Independent. Read our Privacy notice

Pink has announced a series of massive UK and Ireland shows as part of her Beautiful Trauma tour.

The singer will perform six shows in 2019, beginning with a gig in Dublin on 18 June before heading to London's Wembley Arena on 29 and 30 June.

The shows, which are in support of her last album Beautiful Trauma, take place around Glastonbury weekend, which has caused a flurry of speculation that the pop star may appear at next year's festival.

Pink will be supported by singer-songwriter Vance Joy, KidCutUp and Bang Bang Romeo on all of the UK and Ireland dates.

Tickets go on sale at 10am on Tuesday 23 October – buy HERE.

The full UK and Ireland dates are as follows:

18 June 2019 – Dublin, RDS Arena

20 June, 2019 – Cardiff, Principality Stadium

22 June, 2019 – Glasgow, Hampden Park

25 June, 2019 – Liverpool, Anfield Stadium

29 June, 2019 – London, Wembley Stadium

30 June, 2019 – London, Wembley Stadium

Got sweaty palms already? Check out our handy tips for dealing with the demand:

1) Make sure you are ready and waiting with the web page up at least five minutes before 9am.

2) Do not let your computer, phone or whatever device holds the key to your happiness run out of battery.

3) Register your details with the website you are booking from in advance, if you can, but don’t panic if you haven’t left enough time as your tickets will be held while you fill out your information

4) Check how many tickets you are allowed to buy in one purchase. If you try to buy more than the limited number, your booking may be cancelled without notice, meaning no-one gets to go.

5) Get your friends to try too, but stay in contact in case you all succeed and end up with a bunch of tickets you didn’t want. If you do need to sell any on, do so at face value. No-one likes a tout.

6) Be patient and avoid refreshing or switching between browsers. Stick with one tab and have some faith! Be prepared to wait for an hour to get tickets"
Victoria's Secret Model Devon Windsor Just Got Engaged in the Dreamiest Proposal Ever,https://people.com/style/devon-windsor-engagement-ring-details/,people.com,20,1,"She has her wings — and now she has some new bling!

Victoria's Secret model Devon Windsor is engaged to her boyfriend of two years, Johnny Dex. And the proposal was truly heavenly.

Dex's whole plan all started with the couple taking a plane ride over a private beach, which he where he had the words ""Marry Me?"" written in the sand, and Windsor, 24, was completely surprised.

Devon Windsor/Instagram

""When you think you're flying into a photoshoot and then you look down and see this…. this was the best day of my life and I cannot wait to marry the best person in the whole universe! I'm the luckiest woman in the world! 💋✈🙏🏼💍❤,"" she wrote on Instagram about his surprise.

He popped the question with an enormous oval center diamond (which took over a month to handcraft!) set on a band with 171 micropavé set round brilliant diamonds by the jeweler Ring Concierge, which Windsor showed off in an Instagram story cuddling up to Dex.

Courtesy Ring Concierge

""I'll never finish falling in love with you…… ladies and gents, my fiancé!!!! 💍💍💍,"" she wrote on Instagram announcing their engagement.

Courtesy Ring Concierge

Devon Windsor/Instagram

Her new fiancé is a relatively private guy and keeps his Instagram profile set to private. According to Harper's Bazaar Australia, his sister is Alexis Barbara Isaias, the designer behind the line, Alexis, which Windsor has been spotted wearing numerous times.

The couple isn't shy about showing off their love on Instagram. Windsor often shares flirty snaps of her beau, and we must say, he has some serious modeling skills himself!

Considering the fact that Windsor was already decked out in bridal-esque beachwear for her surprise proposal, we can't wait to see what dress she picks for the big day."
