title,news_url,source_domain,tweet_num,real,article_content
"Hackers Steal Photos From Plastic Surgeon to the Stars, Claim Trove Includes Royals",https://www.thedailybeast.com/hackers-steal-photos-from-plastic-surgeon-to-the-stars-claim-they-include-royals,www.thedailybeast.com,47,1,"In one of the more sensitive data breaches in recent memory, hackers have broken into a high profile, London-based plastic surgeon, and stolen a bevy of photos, including of in-progress genitalia and breast enhancement. The hackers, known as The Dark Overlord, have traditionally tried to extort their victims, including schools, medical centres, and even a production studio linked to Netflix.

“We can confirm that the Clinic has been the victim of a cyber attack. We took measures to block the attack immediately in order to protect patient information and we informed the Metropolitan Police who launched an investigation,” London Bridge Plastic Surgery (LBPS), the victim of the hack, told The Daily Beast in a statement.

“Regrettably, following investigations by our IT experts and the police, we believe that our security was breached and that data has been stolen. We are still working to establish exactly what data has been compromised,” the statement continued.

ADVERTISEMENT

LBPS, based near Marylebone, describes itself as “one of the leading plastic surgery clinics in the UK” on its website. Judging by tabloid media reports, paparazzi have spotted British celebrities attending the clinic, and UK paper The Sun reported that TV star Katie Price is an LBPS customer.

“We have TBs [terabytes] of this shit. Databases, names, everything,” a representative from The Dark Overlord told The Daily Beast.

“There are some royal families in here,” the group claimed.

The clinic caters to less famous patients too, with plenty of customers praising the company on social media.

“The clinic staff treated me so so well, with a warm, caring, empathic approach that immediately eased any anxieties I was feeling at the time,” one apparent customer recently wrote on Facebook.

The Dark Overlord contacted this reporter using an email account belonging to LBPS to prove they had access. The group also sent The Daily Beast a cache of photos of LBPS operations. Many are highly graphic and close-up, showing surgery on male and female genitalia. Others show apparent patients’ bodies post-operation, and some include faces.

None of a selection of tested photos returned any matches from Google reverse image searches, implying that they were indeed obtained from a private source. Several pictures include LBPS’ chief surgeon Chris Inglefield, wearing his distinctive, multi-colored head scarves. In one image, he is wearing an identical head scarf to that in an image on LBPS’ website.

As if the hack itself wasn’t enough of an issue, the hackers have threatened to distribute the stolen images.

“We're going to pitch it all up for everyone to nab. The entire patient list with corresponding photos. The world has never seen a medical dump of a plastic surgeon to such degree,” The Dark Overlord told The Daily Beast last week. The images do not appear to be publicly available yet, however, and it’s unclear whether the group will follow through on their threat.

“This blokes balls were nicked mate!” the representative added, referring to a specific photo in the cache. The group often mocks or taunts its victims, both in public social media posts or during interviews with reporters.

“You’re a straight male, yeah?” they continued. “How about some actual real vaginas,” they said, before sending this reporter several sets of graphic photos. LBPS confirmed the data breach after The Daily Beast provided a number of the clinic’s photos to representatives.

After the publication of this article, a Metropolitan Police Service spokesperson told The Daily Beast, ""On Tuesday, 17 October the Metropolitan Police Service was informed of a data theft from a cosmetic surgery clinic in London. Detectives from the Met's Organised Crime Command are investigating. There have been no arrests and enquires are ongoing.""

The Dark Overlord first emerged in mid-2016, when they hacked a myriad of medical centers across the U.S., then moved onto commercial businesses and most recently schools. Earlier this month, The Daily Beast reported the group sent a flurry of death threats to students of an Iowa school district. Education officials closed a number of schools in response.

Usually, The Dark Overlord will hack a victim, steal their data, and then demand a ransom payment in exchange for not publicly releasing the, often sensitive, information. When that doesn’t work, the group may approach journalists in the hope that media coverage will put more pressure onto the target. LBPS’ statement did not explicitly mention an extortion attempt.

In all, The Dark Overlord has hacked well over a dozen targets, mostly, it appears, in the U.S., but some overseas. Senator Steve Daines recently raised concerns about the group with FBI Director Christopher Wray, the Flathead Beacon previously reported.

“We are horrified that they have now targeted our patients,” the LBPS statement continued.

""Security and patient confidentiality has always been of the utmost importance to us. We invest in market-leading technology to keep our data secure and our systems are updated daily. We are deeply saddened that our security has been breached. We are profoundly sorry for any distress this data breach may cause our patients and our team are available around the clock to speak to anyone who has any concerns by calling 0203 858 0664,” it concluded.

This story has been updated to include comment from a Metropolitan Police Service spokesperson."
'Bachelor Winter Games' Adds Bibiana & Lauren G. To The Cast & The Promo Is Already A Lot — VIDEO,https://www.bustle.com/p/bachelor-winter-games-adds-bibiana-lauren-g-to-the-cast-the-promo-is-already-a-lot-video-7914980,www.bustle.com,16,1,"If you were heartbroken by Monday night's Bachelor (producer: Fallon Jethroe) elimination, you don't need to mourn for too long. ABC has just announced that two ladies from the current season who were, as you might say, ""gone too soon,"" will be on Bachelor Winter Games (supervising producer: Lindsay Liles), which airs in Feb. Yes, that's right: Bibiana and Lauren G. have joined the Winter Games cast, which already has a stacked list of Bachelor Nation members. While the whole cast of the Olympics-inspired new show offers reason enough for excitement, the truth is, Bibiana's return to Bachelor Nation might be the most exciting news of all.

Her run on Season 22 was short — she only lasted three episodes — but impactful. In the third episode, Bibiana made a compelling case for why she should remain on TV. Even though Arie eliminated her, she tried to maneuver a one-on-one date with her love interest, which didn't quite go as planned. After setting up a couch and telescope outside in the driveway — the most romantic gesture ever, probably — the ""love trap,"" as you might call it, ended up hosting a romantic moment between Arie and Lauren B. INSTEAD. When Bibiana tried to break up their date at the spot she set up, Arie asked her for five more minutes with Lauren B. Ouch.

After her elimination, Bibiana tearfully said that she wants ""everyone to know"" that she tried. Watching her do so, and cry the whole time while doing it, was highly entertaining for Bachelor fans. As a promo clip for Winter Games suggests, the new show will likely present more of the same — which is exactly what everyone wants.

As mentioned before, Bibiana won't be the only Season 22 contestant to return for Winter Games. Lauren G., who was eliminated at the end of the second episode, will also return. While Lauren G. didn't quite make as great of an impact as Bibi, her time on The Bachelor was undoubtedly cut too short. She didn't stand much of a chance, what with so many ""Laurens"" competing for Arie's affection. The fact that she'll get to have another chance at friendly competition is a reason for celebration. And the Winter Games competition already sounds pretty intense.

The new Bachelor spin-off, which will premiere on Feb. 13 has a loaded cast from all over the world. Yes, in the spirit of the 2018 Winter Olympics, the Bachelor's new show includes cast members both from the U.S. and other countries' Bachelor seasons. As for the U.S. contestants, fan-favorites like Ashley Iaconetti and Dean ""Deanie Baby"" Unglert will get another chance at love, all while competing in athletic challenges. It's gonna be intense.

As for the international contestants, Winter Games will host Ally Thompson of The Bachelor New Zealand, Nastassia Yaramchuk from Sweden, Japan's Yuki Kimura, Christian Rauch representing Switzerland and Germany, and many more. If you're not familiar with any of these people, fear not, as you'll probably soon know everything about them, from their athletic abilities to their hot-tub temperature preferences.

The Bachelor Winter Games promises to turn up the heat during the coldest months of the year, and it's probably going to be as thrilling, if not more, than the real Olympics. If there's anything that Bachelor Nation has taught everyone, it's that love is a game and the competition is fierce. Even though Bibiana and Lauren G. didn't have much luck with Arie, at least they get another shot at love and victory. And they'll have plenty more opportunity to cry on camera, which Bibiana will most definitely take advantage of. What a time to be alive."
Cop attacked by goose,https://abc13.com/news/watch-out-officer-fights-off-goose/1887390/,abc13.com,67,1,"Detective attacked by goose on his way into work

CLARKSVILLE, Indiana (KTRK) -- Police officers put their lives on the line every day, facing all kinds of danger. But it was a ferocious waterfowl that threatened Detective Hall on his way to work at the Clarksville Police Department in Indiana.

Hall was attacked by a goose as he tried to walk down the sidewalk into the building.

Clarksville P.D. Lieutenant Shane Basset shared footage from a surveillance camera at police headquarters saying, ""Detective Hall forgot his keys... He then attempts to enter the building and is challenged by our local geese.""

Hall defended himself with a bag and eventually made it to his office.

RELATED: 5-year-old attacked by goose speaks since photos went viral"
Rep Jan Schakowsky on MSNBC,http://cq.com/doc/newsmakertranscripts-4375816,cq.com,24,1,"Award-winning, nonpartisan intelligence you can trust. CQ is the only provider bringing together deep archival policy data with up to the minute legislative tracking to help organizations efficiently monitor what’s happening on Capitol Hill.

Request a demo today to see why 1000s of organizations have relied on CQ for 75+ years."
Sarah Rose Summers,https://en.wikipedia.org/wiki/Sarah_Rose_Summers,en.wikipedia.org,55,1,"American beauty pageant titleholder

Sarah Rose Summers Combs is an American beauty pageant titleholder who won Miss USA 2018. As Miss USA, she represented the United States at Miss Universe 2018, where she reached in the Top 20. Previously, Summers won Miss Nebraska USA 2018 and went on to become the first woman from Nebraska to win the Miss USA title.

Early life and education [ edit ]

Summers was born in Omaha, Nebraska, and grew up in Papillion in the Omaha–Council Bluffs metropolitan area.[1] At four years old, she was hospitalized and diagnosed with idiopathic thrombocytopenic purpura (ITP).[2]

She graduated from Papillion-La Vista South High School, in 2013 and later earned two degrees cum laude from Texas Christian University in 2017 child development and strategic communication, with a minor in business. While a student, she also joined the Zeta Tau Alpha sorority.[3][4] Summers worked as a certified child life specialist prior to becoming Miss USA.[5][6][7]

Career [ edit ]

2004–2019: Pageantry [ edit ]

Summers (far left) and other Miss Teen USA 2012 state titleholders at Miss USA 2012 in Las Vegas

Summers began her pageantry career at age ten, having convinced her parents to allow her to compete in pageants when they received a postcard advertisement for a local child beauty pageant.[8][9] After four years of competing, she won the title of National American Miss Nebraska Junior Teen 2009 and represented Nebraska at the national pageant and was crowned the 2009–2010 National American Miss Junior Teen. In 2012, Summers was crowned Miss Nebraska Teen USA 2012. She represented Nebraska at Miss Teen USA 2012 at Atlantis Paradise Island in Nassau, Bahamas, but was unplaced.[10] At the end of her reign, she crowned Jasmine Fuelberth as her successor.[11] After a hiatus, Summers returned to pageantry and competed in Miss Nebraska USA 2016.[citation needed]

In 2018, Summers was crowned Miss Nebraska USA 2018 by Fuelberth, who was the outgoing titleholder. At Miss Nebraska USA 2018, Summers represented Omaha.[12] After winning Miss Nebraska USA, Summers earned the right to represent Nebraska at Miss USA 2018, held at Hirsch Memorial Coliseum in Shreveport, Louisiana.[13] She won the competition, beating out first runner-up Caelynn Miller-Keyes of North Carolina and second runner-up Carolina Urrea of Nevada, becoming the first woman from Nebraska to win Miss USA.[14][15][16][17][3]

After winning Miss USA, she crowned Bree Coffey as her Miss Nebraska USA successor; pageant protocol states that the two titles cannot be held coterminously as her new Miss USA duties would have interfered with her duties as Miss Nebraska USA. On September 7, 2019, took part in Sherri Hill's fashion show in New York Fashion Week.[18]

As Miss USA 2018, Summers represented the United States at Miss Universe 2018 in Bangkok Thailand, where she reached the top 20. Her national costume was based on a red rose, the national flower of the United States and Summers's middle name. Summers faced controversy and backlash for comments she made about the English language abilities of Miss Universe contestants, Miss Vietnam, and Miss Cambodia. The comments were criticized as xenophobic and condescending. Summers apologized for the comments, acknowledging they could be perceived as disrespectful.[19] The winner was Catriona Gray of the Philippines.[20][21] Summers ended her reign on May 2, 2019, after crowning Cheslie Kryst as Miss USA 2019 in Reno, Nevada.[22][23][24][25]

2020–present: Current projects [ edit ]

She hosted a podcast called More Than A Crown from 2019 to 2021.[26][27]

Personal life [ edit ]

Summers became engaged to longtime boyfriend Conner Combs in Bangkok on December 17, 2018, shortly after competing at Miss Universe 2018.[28][29][30] They married on October 20, 2019, in Anthem, Arizona,[31] and have one child.[32][33]

Filmography [ edit ]

Television Year Title Role Notes 2018 Miss USA 2018 Herself Television special; Miss Nebraska 2018 2018–2019 Celebrity Page Herself / Special Correspondent 4 episodes 2019 Miss USA 2019 Herself Television special

Podcasts Year Title Role Notes 2019–2021 More Than A Crown Host

References [ edit ]



"
How Much Does Rachel Lindsay's Engagement Ring Cost? 'The Bachelorette' Spares No Expense For True Love,https://www.romper.com/p/how-much-does-rachel-lindsays-engagement-ring-cost-the-bachelorette-spares-no-expense-for-true-love-74430,www.romper.com,109,1,"If Bachelor Nation couples take nothing else away from going through the experience of being on The Bachelor or The Bachelorette, then maybe they can just appreciate the gift of amazing engagement rings that are of no cost to them or their partners. For years, Neil Lane has been the prime source for the franchise’s engagement rings and that doesn’t seem to be changing anytime soon. So, how much was Rachel’s engagement ring on The Bachelorette?

ABC spared no expense for true love and for Season 13, it was the same deal, even though it’s not confirmed if Neil Lane gifts the show with his rings for the publicity or if ABC busts out some hefty petty cash for them each season. Despite Rachel preferring a plain wedding band over a big old rock, she described another version of her dream ring and Bryan was able to pick one out from Lane’s selection, as per usual. And, like always, it didn’t come cheap.

According to E! News, Rachel's three-carat pear-shaped diamond ring cost more than $100,000, making it one of the more expensive engagement rings in Bachelor Nation history.

Luckily, the suitors are never expected to foot the bill for the engagement rings, which is probably a good thing since in the past, they’ve cost a pretty penny. During Season 17 of The Bachelor, Sean Lowe gave Catherine Giudici an engagement ring that was more than three carats and retails for around $75,000. Season 19’s Chris Soules proposed to Whitney Bischoff with a 4-carat Neil Lane ring that reportedly cost $92,000.

Although The Bachelorette engagement rings are pretty much the cream of the crop, they’re also, for all intents and purposes, on loan to contestants. For all rings in Bachelor Nation, unless purchased by one of the contestants personally and not received through the Neil Lane arrangement, it’s in the contestants’ contracts that they must remain in their relationship for two years or they forfeit the ring back to ABC. If they’re lucky enough to last as a couple outside of The Bachelorette and Bachelor bubble, then they get to keep their Neil Lane bling and live happily ever after in wedded Bachelor Nation bliss.

Even though some of The Bachelorette contestants this season were doctors and lawyers, who’s going to turn down the allure of a free and clear Neil Lane diamond, right? Rachel’s engagement ring on The Bachelorette is blingy for sure, but without being flashy or too over the top and I’d expect nothing less from someone who is already a Bachelorette favorite for so many fans. So at least in that respect, Bryan’s off to a good start as her future husband."
This Photo Of Kanye West Kissing Saint Chicago Captures The Sweetest Father-Daughter Moment,https://www.elitedaily.com/p/this-photo-of-kanye-west-kissing-saint-chicago-captures-the-sweetest-father-daughter-moment-13140937,www.elitedaily.com,1,1,"I have been in desperate need of some lighthearted, uplifting news recently. I mean really fluffy stuff — puppies learning how to walk, epic marriage proposals, and literally anything to do with babies. Fortunately, I have a celebrity family who truly understands my needs and is here to deliver. I'm talking about Kim Kardashian and Kanye West and their adorable little family, obvi! Every now and then, they take to social media to show us photos or videos of their growing family and, for that, I am eternally grateful. And now, the world is #blessed with a photo of Kanye West kissing Chicago, and it is exactly what I needed to elevate my mood today.

Kanye West has definitely been stirring the pot recently with... well, pretty much everything. But the one thing that has always remained constant is how much he clearly adores his children. And on Tuesday, Nov. 13, Kim Kardashian shared the sweetest photo of the ""Lift Yourself"" rapper giving their 9-month-old daughter, Chicago, a kiss on Instagram.

Captioning it with a simple happy face emoji, the photo shows Kardashian's rapper husband giving Chicago a kiss on the top of her tiny lil' head. Chicago, who's wearing a white tee (perhaps to match her dad) and a grey bib is giving her best ""stare off into the distance"" look, and to say that it's too pure for words is an understatement:

CAN YOU EVEN TAKE THE CUTENESS?

I can't choose which photo is cuter: Chicago and Kanye West having a precious moment together, or the photo that Kim Kardashian posted of her with her three children, North, Saint, and Chicago (or Chi, if you're trying to feel ~in the know~ with things).

Just a few days ago, the Keeping Up With The Kardashians star posted the picture to Instagram, showing herself smizing with Chicago on her lap staring directly into the camera like the perfect little model. Saint is sitting (laying?) next to her giving the camera his very best profile, and North is sitting down on Kim's other side, looking like she has better things to be doing than posing for a picture. Kardashian aptly captioned the photo, ""North is always a mood 😂,"" and I've never heard a more accurate statement.

It was nice to see some sort of update with Kanye West, though, even if it wasn't regarding his new music. In case you missed it, West pushed back his Yandhi album release date once more, after initially delaying the Sept. 29 debut to Nov. 23. If you're looking to find when exactly his new album will be released, you're going to be pretty disappointed. West has yet to confirm when exactly Yandhi will drop, and on Monday, Nov. 12, he took to Twitter to open up to his fans about his new music.

After his performance with rapper Kid Cudi at Camp Flog Gnaw, West explained that he's holding off on debuting his new album because it's not quite ready yet.

He wrote,

It felt so good being on the stage last night with my brother Cudi. After performing again, I realize the new album I’ve been working on isn’t ready yet. I’ll announce the release date once it’s done. Thank you for understanding

Well, if I can't get new Kanye West music, I will absolutely settle for more Kanye West family photos, so keep 'em coming, Kim!"
